{
  "schema_version": "1.0.0",
  "artifact_id": "art_20260828_8f3a1c9",
  "project_name": "tour_monitor",
  "artifact_type": "container_image",
  "canonical_reference": "ghcr.io/org/tour-monitor@sha256:7f83b1657ff1fc53b92dc18148a1d65dfc2d4b1fa3d677284addd200126d9069",
  "immutable_digest": "sha256:7f83b1657ff1fc53b92dc18148a1d65dfc2d4b1fa3d677284addd200126d9069",
  "human_readable_tags": ["latest", "sha-8f3a1c9", "v16.55"],
  "source_commit": "8f3a1c9b2e04d7119024fbc09123456789abcdef",
  "source_branch": "master",
  "build_timestamp": "2026-08-28T18:20:00Z",
  "builder_metadata": {
    "ci_run_id": "123456789",
    "runner_os": "ubuntu-22.04",
    "toolchain": "docker-buildx-v0.12"
  },
  "signature": {
    "provenance_attestation": "cosign.attestation.verified",
    "key_id": "key_ghcr_prod",
    "verified": true
  }
}
